title,year,citations,cited_by_url
A multi-agent system for the automation of a port container terminal,2000,75,"https://scholar.google.com.tw/scholar?start=00&hl=en&as_sdt=2005&sciodt=0,5&cites=9309426555546589354&scipsc="
TRACES: TRAFFIC CONTROL ENGINEERING SYSTEM A case-study on container terminal automation,1999,27,"https://scholar.google.com.tw/scholar?start=00&hl=en&as_sdt=2005&sciodt=0,5&cites=6171787941291428034&scipsc="
Automation in port container terminals,2014,49,"https://scholar.google.com.tw/scholar?start=00&hl=en&as_sdt=2005&sciodt=0,5&cites=16200645956702243205&scipsc="
Multi-agent system technology in a port container terminal automation,2004,13,"https://scholar.google.com.tw/scholar?start=00&hl=en&as_sdt=2005&sciodt=0,5&cites=3086980972259741507&scipsc="
Alignments between strategic content and process structure: the case of container terminal service process automation,2019,14,"https://scholar.google.com.tw/scholar?start=00&hl=en&as_sdt=2005&sciodt=0,5&cites=14852389085083582985&scipsc="
A Study on Application of Yard Transportaion Equipment Automation System in the Container Terminal,2018,5,"https://scholar.google.com.tw/scholar?start=00&hl=en&as_sdt=2005&sciodt=0,5&cites=7027991686810156965&scipsc="
Container port automation,2006,13,"https://scholar.google.com.tw/scholar?start=00&hl=en&as_sdt=2005&sciodt=0,5&cites=2428285333085990610&scipsc="
New technologies and the transformation of work and skills: a study of computerisation and automation of Australian container terminals,2018,30,"https://scholar.google.com.tw/scholar?start=00&hl=en&as_sdt=2005&sciodt=0,5&cites=3038243621657882594&scipsc="
Strategic analysis of the automation of container port terminals through BOT (business observation tool),2020,9,"https://scholar.google.com.tw/scholar?start=00&hl=en&as_sdt=2005&sciodt=0,5&cites=7776988263832702778&scipsc="
Automation of the Road Gate Operations Process at the Container Terminal—A Case Study of DCT Gdańsk SA,2021,0,"https://scholar.google.com.tw/scholar?start=00&hl=en&as_sdt=2005&sciodt=0,5&cites=7776988263832702778&scipsc="
Cyber threats in maritime container terminal automation systems,2016,4,"https://scholar.google.com.tw/scholar?start=00&hl=en&as_sdt=2005&sciodt=0,5&cites=15491946016518746834&scipsc="
Cooperative Scheduling of AGV and ASC in Automation Container Terminal Relay Operation Mode,2021,1,"https://scholar.google.com.tw/scholar?start=00&hl=en&as_sdt=2005&sciodt=0,5&cites=4551625296024943951&scipsc="
Performance analysis of a new type of automated container terminal,2014,8,"https://scholar.google.com.tw/scholar?start=00&hl=en&as_sdt=2005&sciodt=0,5&cites=5423973718458925932&scipsc="
A Study on Application of Yard Transportaion Equipment Automation System in the Container Terminal,2018,2,"https://scholar.google.com.tw/scholar?start=00&hl=en&as_sdt=2005&sciodt=0,5&cites=11944721833548426223&scipsc="
Analysis of Automation Implementation in Indonesia Container Terminal,2020,0,"https://scholar.google.com.tw/scholar?start=00&hl=en&as_sdt=2005&sciodt=0,5&cites=11944721833548426223&scipsc="
Container Terminal Automation: Feasibility of terminal automation for mid-sized terminals,2007,1,"https://scholar.google.com.tw/scholar?start=00&hl=en&as_sdt=2005&sciodt=0,5&cites=13331795259438174147&scipsc="
The Automation Market for North American Container Terminals,2015,1,"https://scholar.google.com.tw/scholar?start=00&hl=en&as_sdt=2005&sciodt=0,5&cites=16310894496147540939&scipsc="
Container terminal operation: current trends and future challenges,2015,55,"https://scholar.google.com.tw/scholar?start=00&hl=en&as_sdt=2005&sciodt=0,5&cites=11814704950848771209&scipsc="
Automation: a process redesign,1996,6,"https://scholar.google.com.tw/scholar?start=00&hl=en&as_sdt=2005&sciodt=0,5&cites=1439526330785915733&scipsc="
Gate automation system evaluation: a case of a container number recognition system in port terminals,2017,13,"https://scholar.google.com.tw/scholar?start=00&hl=en&as_sdt=2005&sciodt=0,5&cites=10055908548555998147&scipsc="
Modeling and analysis for an automated container terminal considering battery management,2021,2,"https://scholar.google.com.tw/scholar?start=00&hl=en&as_sdt=2005&sciodt=0,5&cites=1545349967120072319&scipsc="
Improving performance at the Durban container terminal through automation: urban and rural engineering,2015,1,"https://scholar.google.com.tw/scholar?start=00&hl=en&as_sdt=2005&sciodt=0,5&cites=16660777904447961090&scipsc="
Automizing the manual link in maritime supply chains? An analysis of twistlock handling automation in container terminals,2021,1,"https://scholar.google.com.tw/scholar?start=00&hl=en&as_sdt=2005&sciodt=0,5&cites=5576548718068105224&scipsc="
Container terminal handling technology and its development,2019,2,"https://scholar.google.com.tw/scholar?start=00&hl=en&as_sdt=2005&sciodt=0,5&cites=17628429712610871435&scipsc="
Automation of ship-to-shore container cranes: A review of state-of-the-art,2005,48,"https://scholar.google.com.tw/scholar?start=00&hl=en&as_sdt=2005&sciodt=0,5&cites=4437765653531111902&scipsc="
New Technologies Used for Automation of Container Handling at Terminals,2014,1,"https://scholar.google.com.tw/scholar?start=00&hl=en&as_sdt=2005&sciodt=0,5&cites=15903116584115451077&scipsc="
Trends in marine terminal automation,2012,5,"https://scholar.google.com.tw/scholar?start=00&hl=en&as_sdt=2005&sciodt=0,5&cites=13456835515442743063&scipsc="
Container terminal automation: classification and sustainability,2019,0,"https://scholar.google.com.tw/scholar?start=00&hl=en&as_sdt=2005&sciodt=0,5&cites=13456835515442743063&scipsc="
Design of automatic container terminal monitoring system [J],2011,1,"https://scholar.google.com.tw/scholar?start=00&hl=en&as_sdt=2005&sciodt=0,5&cites=7196699048933865081&scipsc="
Deadlock prevention for automated guided vehicles in automated container terminals,2007,80,"https://scholar.google.com.tw/scholar?start=00&hl=en&as_sdt=2005&sciodt=0,5&cites=1202116420382402356&scipsc="
Managing the Implementation of Container Terminal Automation,2016,0,"https://scholar.google.com.tw/scholar?start=00&hl=en&as_sdt=2005&sciodt=0,5&cites=1202116420382402356&scipsc="
Distributed agent architecture for port automation,2002,89,"https://scholar.google.com.tw/scholar?start=00&hl=en&as_sdt=2005&sciodt=0,5&cites=2027587594897966101&scipsc="
Design of GPS Positioning and Control for Forklifts in Automation Container Dock [J],2011,3,"https://scholar.google.com.tw/scholar?start=00&hl=en&as_sdt=2005&sciodt=0,5&cites=17275577201043056599&scipsc="
Design of automatic container terminal monitoring system based on OPC technology,2011,2,"https://scholar.google.com.tw/scholar?start=00&hl=en&as_sdt=2005&sciodt=0,5&cites=18065968202550828080&scipsc="
A study on port design automation concept,2008,10,"https://scholar.google.com.tw/scholar?start=00&hl=en&as_sdt=2005&sciodt=0,5&cites=17193215584651231974&scipsc="
Robotic automation of inland container terminals,2020,0,"https://scholar.google.com.tw/scholar?start=00&hl=en&as_sdt=2005&sciodt=0,5&cites=17193215584651231974&scipsc="
A Multi-Agent System for Container Terminal Automation,2007,0,"https://scholar.google.com.tw/scholar?start=00&hl=en&as_sdt=2005&sciodt=0,5&cites=17193215584651231974&scipsc="
"Equipment, automation and operation",1980,2,"https://scholar.google.com.tw/scholar?start=00&hl=en&as_sdt=2005&sciodt=0,5&cites=12736619275329843844&scipsc="
AUTOMATION OF A STRADDLE-CARRIER OPERATION,1996,2,"https://scholar.google.com.tw/scholar?start=00&hl=en&as_sdt=2005&sciodt=0,5&cites=5435330206176002834&scipsc="
Automation of handling systems in the container terminals of maritime ports,2019,1,"https://scholar.google.com.tw/scholar?start=00&hl=en&as_sdt=2005&sciodt=0,5&cites=5083452412548478300&scipsc="
Productivity of Container Terminal Operations Through Automation,0,0,"https://scholar.google.com.tw/scholar?start=00&hl=en&as_sdt=2005&sciodt=0,5&cites=5083452412548478300&scipsc="
PRODUCTIVITY OF CONTAINER TERMINAL OPERATIONS THROUGH AUTOMATION,2015,0,"https://scholar.google.com.tw/scholar?start=00&hl=en&as_sdt=2005&sciodt=0,5&cites=5083452412548478300&scipsc="
An architectural design of control software for automated container terminals,2004,46,"https://scholar.google.com.tw/scholar?start=00&hl=en&as_sdt=2005&sciodt=0,5&cites=4563229490220112997&scipsc="
System design for gate house automation in a container terminal,1996,0,"https://scholar.google.com.tw/scholar?start=00&hl=en&as_sdt=2005&sciodt=0,5&cites=4563229490220112997&scipsc="
AUTOMATION IN THE CONTAINER TERMINALS OF THE PORT OF HAMBURG,2019,0,"https://scholar.google.com.tw/scholar?start=00&hl=en&as_sdt=2005&sciodt=0,5&cites=4563229490220112997&scipsc="
Process and equipment automation for container terminals,2010,1,"https://scholar.google.com.tw/scholar?start=00&hl=en&as_sdt=2005&sciodt=0,5&cites=436871033959380087&scipsc="
Container terminal logistics computation performance evaluation with great principles of computing and case study,2018,3,"https://scholar.google.com.tw/scholar?start=00&hl=en&as_sdt=2005&sciodt=0,5&cites=4704546981718624198&scipsc="
Research on the system technology for automated container terminal,2017,4,"https://scholar.google.com.tw/scholar?start=00&hl=en&as_sdt=2005&sciodt=0,5&cites=6194370367714829431&scipsc="
Automation in Container Port Systems and Management,2021,2,"https://scholar.google.com.tw/scholar?start=00&hl=en&as_sdt=2005&sciodt=0,5&cites=6194370367714829431&scipsc="
The path to automation in an RTG terminal,2018,2,"https://scholar.google.com.tw/scholar?start=00&hl=en&as_sdt=2005&sciodt=0,5&cites=16534896223689554193&scipsc="
